{
  "schemaVersion": "omnitwin.foundry.local-hd-worker-manifest.v0",
  "manifestId": "omnitwin-local-hd-worker-candidate-2026-07-19",
  "reviewedOn": "2026-07-19",
  "reviewClass": "engineering_screen_only",
  "overall": "planned_not_installed_not_execution_ready",
  "manifestState": "recorded_with_open_closure_items",
  "installationState": "not_installed",
  "runtimeVerificationState": "not_performed",
  "binding": "not_bound_to_current_source_or_plan",
  "execution": "disabled",
  "authority": "none",
  "architecture": {
    "localWindows": {
      "status": "planned_components_only",
      "gaussianTraining": "not_enabled"
    },
    "gpuWorker": {
      "status": "separate_review_required",
      "canonicalForGaussianTraining": true,
      "workerImage": "not_defined"
    }
  },
  "activity": {
    "workerInstallationPerformed": false,
    "workerRuntimeVerificationPerformed": false,
    "venueDataAccessed": false,
    "cloudWorkloadStarted": false,
    "modelOptimizationStarted": false
  },
  "capabilityLanes": [
    {
      "id": "e57_read_only_intake",
      "label": "Read-only E57 intake",
      "runtimeProfile": "Independent Windows x64 CPython 3.10 candidate profile",
      "componentIds": [
        "pye57",
        "libe57format",
        "xerces-c"
      ],
      "executionLocation": "local_windows_candidate",
      "state": "planned_closure_incomplete_execution_disabled",
      "boundary": "The existing probe is not wired to this screen and its dependency bytes are not yet bound. No E57 worker is ready."
    },
    {
      "id": "geometry_registration_and_qa",
      "label": "Geometry registration and QA",
      "runtimeProfile": "Independent Open3D Windows x64 CPython 3.10 candidate profile",
      "componentIds": [
        "open3d"
      ],
      "executionLocation": "local_windows_candidate",
      "state": "planned_closure_incomplete_execution_disabled",
      "boundary": "Only the Open3D root wheel is pinned. Its Python and compiled third-party closure is still open; optional ML, model, dataset, and CUDA content is excluded."
    },
    {
      "id": "camera_registration",
      "label": "Camera registration",
      "runtimeProfile": "Independent COLMAP no-CUDA binary plus weight-free hloc source profile",
      "componentIds": [
        "colmap",
        "hloc"
      ],
      "executionLocation": "local_windows_candidate",
      "state": "planned_closure_incomplete_execution_disabled",
      "boundary": "The initial hloc allow-list is SIFT, nearest-neighbour matching, exhaustive pairs, and pycolmap only. No learned model or automatic download is allowed."
    },
    {
      "id": "gaussian_training",
      "label": "Gaussian training",
      "runtimeProfile": "Separate reviewed Python 3.10, PyTorch, CUDA GPU-worker profile",
      "componentIds": [
        "gsplat"
      ],
      "executionLocation": "reviewed_remote_gpu_worker_only",
      "state": "execution_disabled_under_current_architecture",
      "boundary": "Execution is disabled under the current architecture. Local Windows Gaussian training is not enabled; a new immutable reviewed GPU-worker image is required."
    },
    {
      "id": "photometric_compensation",
      "label": "Photometric compensation",
      "runtimeProfile": "Separate reviewed PPISP GPU-worker candidate profile",
      "componentIds": [
        "ppisp"
      ],
      "executionLocation": "reviewed_remote_gpu_worker_only",
      "state": "planned_closure_incomplete_execution_disabled",
      "boundary": "PPISP remains an optional separate derivative step. Its runtime dependencies and attributions are not closed and its optional dataset is excluded."
    }
  ],
  "components": [
    {
      "id": "pye57",
      "label": "pye57",
      "role": "Read-only E57 Python wrapper candidate",
      "version": "0.4.19",
      "tag": "v0.4.19",
      "revision": "64c9000738ad54242e87e1da6bca6b683b13374b",
      "repository": "https://github.com/davidcaron/pye57",
      "artifact": {
        "kind": "pypi_wheel",
        "url": "https://files.pythonhosted.org/packages/51/9c/95f355e5a2f3fe5654d3d518831b91aa0c6943f66690750e9ac3f7fe3d9d/pye57-0.4.19-cp310-cp310-win_amd64.whl",
        "byteSize": 1128676,
        "sha256": "b0fdc023d88706739ff5bfa22022bd69611b2394298d477a9cc91c669c4cbcf8",
        "digestEvidence": "publisher_attested_and_observed",
        "reverifyOnAcquire": true
      },
      "licenseSpdx": "MIT",
      "legalTexts": [
        {
          "kind": "license",
          "label": "pye57 MIT licence",
          "url": "https://raw.githubusercontent.com/davidcaron/pye57/64c9000738ad54242e87e1da6bca6b683b13374b/LICENSE",
          "byteSize": 1050,
          "sha256": "7e4eba8170c2d4e56bba2c744c9ead1861fabda3ff54ecc13c44d9df1c6732c6",
          "redistributionRequired": true
        }
      ],
      "noticeClosureStatus": "missing_from_selected_binary",
      "closureStatus": "root_identity_pinned_dependency_closure_open",
      "closureItems": [
        "Pin an exact CPython 3.10 Windows x64 interpreter artifact and hash.",
        "Pin NumPy, pyquaternion, and every transitive artifact, licence, and notice.",
        "Package the libE57Format, CRC++, and Xerces legal texts omitted from the selected wheel.",
        "Reconcile this CPython 3.10 wheel profile with the current Python 3.13 local-probe evidence before enabling it."
      ],
      "excludedAssets": [
        "Source E57 files, embedded images, point records, and venue data are not dependency assets and were not accessed for this manifest."
      ],
      "installationState": "not_installed",
      "runtimeVerificationState": "not_performed",
      "execution": "disabled"
    },
    {
      "id": "libe57format",
      "label": "libE57Format",
      "role": "Native E57 core pinned by pye57 0.4.19",
      "version": "3.1.1",
      "tag": "v3.1.1",
      "revision": "1914b8ea972251d3bb49a33828497dde683205d9",
      "repository": "https://github.com/asmaloney/libE57Format",
      "artifact": {
        "kind": "github_tag_archive",
        "url": "https://github.com/asmaloney/libE57Format/archive/refs/tags/v3.1.1.tar.gz",
        "byteSize": 207108,
        "sha256": "949e73db3cb90ed7d286c49d12c6925813ead8d92ff9b84e0fba17fa015194d0",
        "digestEvidence": "observed",
        "reverifyOnAcquire": true
      },
      "licenseSpdx": "BSL-1.0 AND MIT AND BSD-3-Clause",
      "legalTexts": [
        {
          "kind": "license",
          "label": "libE57Format Boost Software License 1.0",
          "url": "https://raw.githubusercontent.com/asmaloney/libE57Format/1914b8ea972251d3bb49a33828497dde683205d9/LICENSE.md",
          "byteSize": 1338,
          "sha256": "c9bff75738922193e67fa726fa225535870d2aa1059f91452c411736284ad566",
          "redistributionRequired": true
        },
        {
          "kind": "license",
          "label": "libE57Format auxiliary MIT licence",
          "url": "https://raw.githubusercontent.com/asmaloney/libE57Format/1914b8ea972251d3bb49a33828497dde683205d9/LICENSE-MIT.md",
          "byteSize": 1101,
          "sha256": "8ce9ce1a2d14d0a5ddccb915017e9e0e2a4d5c12b5559d227ecdd3342ab94fa9",
          "redistributionRequired": true
        },
        {
          "kind": "license",
          "label": "Bundled CRC++ BSD-3-Clause licence",
          "url": "https://raw.githubusercontent.com/asmaloney/libE57Format/1914b8ea972251d3bb49a33828497dde683205d9/extern/CRCpp/LICENSE",
          "byteSize": 1480,
          "sha256": "954e7c6730168114b296fbcc60532fa7ce64236e1adf17c147878bb7949be09e",
          "redistributionRequired": true
        }
      ],
      "noticeClosureStatus": "open_dependency_notice_review",
      "closureStatus": "root_identity_pinned_dependency_closure_open",
      "closureItems": [
        "Reverify the observed GitHub tag archive against the immutable commit on every acquisition.",
        "Pin the Windows compiler, build flags, runtime libraries, and complete native dependency tree.",
        "Bind the exact native files incorporated into the eventual pye57 runtime bundle."
      ],
      "excludedAssets": [
        "Repository fixtures and example E57 files are excluded from the worker bundle."
      ],
      "installationState": "not_installed",
      "runtimeVerificationState": "not_performed",
      "execution": "disabled"
    },
    {
      "id": "xerces-c",
      "label": "Apache Xerces-C++",
      "role": "XML dependency selected by the pye57 0.4.19 Windows build",
      "version": "3.2.3",
      "tag": "v3.2.3",
      "revision": "cf1912ac95d4147be08aef4e78f894a3919277d9",
      "repository": "https://github.com/apache/xerces-c",
      "artifact": {
        "kind": "source_archive",
        "url": "https://archive.apache.org/dist/xerces/c/3/sources/xerces-c-3.2.3.tar.gz",
        "byteSize": 7120270,
        "sha256": "fb96fc49b1fb892d1e64e53a6ada8accf6f0e6d30ce0937956ec68d39bd72c7e",
        "digestEvidence": "publisher_attested_and_observed",
        "reverifyOnAcquire": true
      },
      "licenseSpdx": "Apache-2.0",
      "legalTexts": [
        {
          "kind": "license",
          "label": "Apache Xerces-C++ licence",
          "url": "https://raw.githubusercontent.com/apache/xerces-c/cf1912ac95d4147be08aef4e78f894a3919277d9/LICENSE",
          "byteSize": 11358,
          "sha256": "cfc7749b96f63bd31c3c42b5c471bf756814053e847c10f3eb003417bc523d30",
          "redistributionRequired": true
        },
        {
          "kind": "notice",
          "label": "Apache Xerces-C++ NOTICE",
          "url": "https://raw.githubusercontent.com/apache/xerces-c/cf1912ac95d4147be08aef4e78f894a3919277d9/NOTICE",
          "byteSize": 560,
          "sha256": "95e5cca2ff3d0801841d9d17f0eec16bfb02dd6893ff7e55da4ec5a5dd30aa52",
          "redistributionRequired": true
        }
      ],
      "noticeClosureStatus": "missing_from_selected_binary",
      "closureStatus": "root_identity_pinned_dependency_closure_open",
      "closureItems": [